{
  "$schema": "http://json-schema.org/draft-07/schema#",
  "title": "Implementation Plan Schema",
  "description": "Schema for AI-Q implementation plans",
  "type": "object",
  "required": ["id", "title", "description", "status", "phases", "metadata"],
  "properties": {
    "id": {
      "type": "string",
      "pattern": "^plan_[0-9]{4}_[0-9]{2}_[a-z_]+$",
      "description": "Unique plan identifier"
    },
    "title": {
      "type": "string",
      "minLength": 1,
      "maxLength": 200,
      "description": "Human-readable plan title"
    },
    "description": {
      "type": "string",
      "minLength": 10,
      "maxLength": 1000,
      "description": "Detailed plan description"
    },
    "status": {
      "type": "string",
      "enum": ["active", "completed", "paused", "cancelled"],
      "description": "Current plan status"
    },
    "priority": {
      "type": "string",
      "enum": ["critical", "high", "medium", "low"],
      "description": "Plan priority level"
    },
    "phases": {
      "type": "array",
      "minItems": 1,
      "items": {
        "type": "object",
        "required": ["id", "title", "description", "status", "completion"],
        "properties": {
          "id": {
            "type": "string",
            "pattern": "^phase_[0-9]+_[a-z_]+$",
            "description": "Unique phase identifier"
          },
          "title": {
            "type": "string",
            "minLength": 1,
            "maxLength": 100,
            "description": "Phase title"
          },
          "description": {
            "type": "string",
            "minLength": 10,
            "maxLength": 500,
            "description": "Phase description"
          },
          "status": {
            "type": "string",
            "enum": ["not_started", "in_progress", "completed", "blocked"],
            "description": "Phase status"
          },
          "completion": {
            "type": "number",
            "minimum": 0,
            "maximum": 100,
            "description": "Phase completion percentage"
          },
          "start_date": {
            "type": "string",
            "format": "date",
            "description": "Phase start date"
          },
          "end_date": {
            "type": "string",
            "format": "date",
            "description": "Phase end date"
          },
          "milestones": {
            "type": "array",
            "items": {
              "type": "object",
              "required": ["id", "title", "description", "status"],
              "properties": {
                "id": {
                  "type": "string",
                  "pattern": "^milestone_[0-9]+_[0-9]+$",
                  "description": "Unique milestone identifier"
                },
                "title": {
                  "type": "string",
                  "minLength": 1,
                  "maxLength": 100,
                  "description": "Milestone title"
                },
                "description": {
                  "type": "string",
                  "minLength": 10,
                  "maxLength": 300,
                  "description": "Milestone description"
                },
                "status": {
                  "type": "string",
                  "enum": ["not_started", "in_progress", "completed", "blocked"],
                  "description": "Milestone status"
                },
                "completion_date": {
                  "type": "string",
                  "format": "date-time",
                  "description": "Date when milestone was completed"
                }
              }
            }
          },
          "tasks": {
            "type": "array",
            "items": {
              "type": "object",
              "required": ["id", "title", "description", "status"],
              "properties": {
                "id": {
                  "type": "string",
                  "pattern": "^task_[0-9]+_[0-9]+_[0-9]+$",
                  "description": "Unique task identifier"
                },
                "title": {
                  "type": "string",
                  "minLength": 1,
                  "maxLength": 100,
                  "description": "Task title"
                },
                "description": {
                  "type": "string",
                  "minLength": 10,
                  "maxLength": 300,
                  "description": "Task description"
                },
                "status": {
                  "type": "string",
                  "enum": ["not_started", "in_progress", "completed", "blocked"],
                  "description": "Task status"
                },
                "assignee": {
                  "type": "string",
                  "description": "Task assignee"
                },
                "estimated_hours": {
                  "type": "number",
                  "minimum": 0,
                  "description": "Estimated hours for task"
                },
                "actual_hours": {
                  "type": "number",
                  "minimum": 0,
                  "description": "Actual hours spent on task"
                },
                "start_date": {
                  "type": "string",
                  "format": "date",
                  "description": "Task start date"
                },
                "completion_date": {
                  "type": "string",
                  "format": "date-time",
                  "description": "Task completion date"
                }
              }
            }
          }
        }
      }
    },
    "metrics": {
      "type": "object",
      "properties": {
        "overall_completion": {
          "type": "number",
          "minimum": 0,
          "maximum": 100,
          "description": "Overall plan completion percentage"
        },
        "phases_completed": {
          "type": "number",
          "minimum": 0,
          "description": "Number of completed phases"
        },
        "total_tasks": {
          "type": "number",
          "minimum": 0,
          "description": "Total number of tasks"
        },
        "completed_tasks": {
          "type": "number",
          "minimum": 0,
          "description": "Number of completed tasks"
        },
        "blocked_tasks": {
          "type": "number",
          "minimum": 0,
          "description": "Number of blocked tasks"
        },
        "resource_utilization": {
          "type": "number",
          "minimum": 0,
          "maximum": 1,
          "description": "Resource utilization ratio"
        }
      }
    },
    "dependencies": {
      "type": "array",
      "items": {
        "type": "object",
        "required": ["type", "description", "status"],
        "properties": {
          "type": {
            "type": "string",
            "enum": ["external", "internal", "technical", "resource"],
            "description": "Dependency type"
          },
          "description": {
            "type": "string",
            "minLength": 10,
            "maxLength": 300,
            "description": "Dependency description"
          },
          "status": {
            "type": "string",
            "enum": ["pending", "in_progress", "resolved", "blocked"],
            "description": "Dependency status"
          },
          "resolved_date": {
            "type": "string",
            "format": "date-time",
            "description": "Date when dependency was resolved"
          }
        }
      }
    },
    "risks": {
      "type": "array",
      "items": {
        "type": "object",
        "required": ["id", "description", "probability", "impact"],
        "properties": {
          "id": {
            "type": "string",
            "pattern": "^risk_[0-9]+$",
            "description": "Unique risk identifier"
          },
          "description": {
            "type": "string",
            "minLength": 10,
            "maxLength": 300,
            "description": "Risk description"
          },
          "probability": {
            "type": "string",
            "enum": ["low", "medium", "high"],
            "description": "Risk probability"
          },
          "impact": {
            "type": "string",
            "enum": ["low", "medium", "high"],
            "description": "Risk impact"
          },
          "mitigation": {
            "type": "string",
            "minLength": 10,
            "maxLength": 500,
            "description": "Risk mitigation strategy"
          },
          "status": {
            "type": "string",
            "enum": ["open", "mitigated", "closed"],
            "description": "Risk status"
          }
        }
      }
    },
    "metadata": {
      "type": "object",
      "required": ["created", "created_by", "version"],
      "properties": {
        "created": {
          "type": "string",
          "format": "date-time",
          "description": "Plan creation timestamp"
        },
        "updated": {
          "type": "string",
          "format": "date-time",
          "description": "Last update timestamp"
        },
        "created_by": {
          "type": "string",
          "description": "Plan creator"
        },
        "version": {
          "type": "string",
          "pattern": "^[0-9]+\\.[0-9]+\\.[0-9]+$",
          "description": "Plan version"
        },
        "tags": {
          "type": "array",
          "items": {
            "type": "string"
          },
          "description": "Plan tags for categorization"
        }
      }
    }
  }
} 